{
  "$schema": "http://json-schema.org/draft-07/schema",
  "title": "Artist",
  "type": "object",
  "properties": {
    "id": {
      "type": "string",
      "minLength": 1,
      "description": "The unique identifier for the artist or band"
    },
    "name": {
      "type": "string",
      "minLength": 1,
      "description": "The name of the artist or band"
    },
    "dateAdded": {
      "type": [
        "string",
        "null"
      ],
      "format": "date",
      "description": "Date this artist was added to the database (YYYY-MM-DD format)"
    },
    "dateUpdated": {
      "type": [
        "string",
        "null"
      ],
      "format": "date",
      "description": "Date this entry was last updated (YYYY-MM-DD format), or null if never updated"
    },
    "comments": {
      "type": [
        "string",
        "null"
      ],
      "description": "Additional notes or context about why this artist is considered AI-generated, or null if no comments"
    },
    "spotify": {
      "type": [
        "string",
        "null"
      ],
      "format": "uri",
      "description": "Spotify artist URL (use clean link), or null if not available"
    },
    "apple": {
      "type": [
        "string",
        "null"
      ],
      "format": "uri",
      "description": "Apple Music artist URL (prefer US link), or null if not available"
    },
    "youtube": {
      "type": [
        "string",
        "null"
      ],
      "format": "uri",
      "description": "YouTube channel URL, or null if not available"
    },
    "instagram": {
      "type": [
        "string",
        "null"
      ],
      "format": "uri",
      "description": "Instagram profile URL, or null if not available"
    },
    "tiktok": {
      "type": [
        "string",
        "null"
      ],
      "format": "uri",
      "description": "TikTok profile URL, or null if not available"
    },
    "amazon": {
      "type": [
        "string",
        "null"
      ],
      "format": "uri",
      "description": "Amazon profile URL, or null if not available"
    },
    "urls": {
      "type": "array",
      "description": "Supporting evidence URLs (e.g., Reddit posts, blog articles, etc.)",
      "items": {
        "type": "string",
        "format": "uri"
      }
    },
    "tags": {
      "type": "array",
      "description": "Special tags/flags for this artist",
      "items": {
        "anyOf": [
          {
            "type": "string",
            "enum": [
              "partial-ai",
              "human-lyrics",
              "anon-project",
              "high-output",
              "inconsistent-style",
              "external"
            ]
          },
          {
            "type": "string"
          }
        ]
      },
      "uniqueItems": true
    }
  },
  "required": [
    "id",
    "name",
    "dateAdded",
    "dateUpdated",
    "comments",
    "spotify",
    "apple",
    "youtube",
    "instagram",
    "tiktok",
    "amazon",
    "urls",
    "tags"
  ],
  "additionalProperties": false
}