{
  "id": "olivia-baynton",
  "name": "Olivia Baynton",
  "dateAdded": "2025-12-15T15:44:40.000Z",
  "dateUpdated": "2025-12-23T16:52:06.000Z",
  "comments": null,
  "tags": [],
  "spotify": "https://open.spotify.com/artist/2iPSM4g1ILRqdu230ae2Gr",
  "apple": "https://music.apple.com/us/artist/1808939897",
  "youtube": "https://www.youtube.com/@Olivia_Baynton",
  "instagram": null,
  "tiktok": null,
  "amazon": "https://music.amazon.com/artists/B0F54M7YQK",
  "urls": []
}
