{
  "id": "crimson-sorrow",
  "name": "Crimson Sorrow",
  "dateAdded": "2025-12-03T23:52:35.000Z",
  "dateUpdated": "2025-12-22T16:56:05.000Z",
  "comments": null,
  "tags": [
    "high-output",
    "anonymous"
  ],
  "spotify": "https://open.spotify.com/artist/2Gw3WYi60bVLy6YztUsxkT",
  "apple": "https://music.apple.com/us/artist/1787809224",
  "youtube": "https://www.youtube.com/@CrimsonSorrow-band",
  "instagram": null,
  "tiktok": "https://www.tiktok.com/@crimsonsorrowband",
  "amazon": "https://music.amazon.com/artists/B0DCJL6YDK",
  "urls": []
}
