{
  "id": "ladyan",
  "name": "LadyAn",
  "dateAdded": "2026-01-02T13:43:20.000Z",
  "dateUpdated": "2026-01-02T14:57:36.000Z",
  "comments": "The artistâ€™s back catalog consists exclusively of releases from 2025 as of the time of writing, accompanied by AI-generated visuals.",
  "tags": [
    "ai-visuals",
    "high-output",
    "no-social-presence",
    "partial-ai"
  ],
  "spotify": "7baklZiKsChz4UqHTpynJg",
  "apple": "1828916810",
  "amazon": "B0B5DFK453",
  "youtube": "@ladyan-hitmusic",
  "tiktok": null,
  "instagram": null,
  "urls": []
}
