{
  "id": "ansi",
  "name": "ANSI",
  "dateAdded": "2025-12-07T22:32:40.000Z",
  "dateUpdated": "2025-12-22T21:42:35.000Z",
  "comments": null,
  "tags": [
    "high-output",
    "anonymous"
  ],
  "spotify": "https://open.spotify.com/artist/6Fr8t6zYm03eCUYYWy7ZrG",
  "apple": "https://music.apple.com/us/artist/1680168861",
  "youtube": "https://www.youtube.com/channel/UCWnvJ4cVd4AaAWV_L466iOg",
  "instagram": null,
  "tiktok": null,
  "amazon": "https://music.amazon.com/artists/B0753CZTK4",
  "urls": []
}
