{
  "id": "the-rn-b-exchange",
  "name": "The RnB Exchange",
  "dateAdded": "2025-12-17T15:10:49.000Z",
  "dateUpdated": "2025-12-23T16:52:06.000Z",
  "comments": null,
  "tags": [
    "high-output"
  ],
  "spotify": "https://open.spotify.com/artist/2p4sW1WQiNyZLn7X8kiVqP",
  "apple": "https://music.apple.com/us/artist/1812762820",
  "youtube": "https://www.youtube.com/@TheRnBExchange",
  "instagram": null,
  "tiktok": null,
  "amazon": "https://music.amazon.com/artists/B0F7NM2T99",
  "urls": []
}
