{
  "id": "luminary-flux",
  "name": "Luminary Flux",
  "dateAdded": "2026-01-02T14:15:12.000Z",
  "dateUpdated": "2026-01-02T15:10:59.000Z",
  "comments": "AI-generated album artwork, with no visible presence or evidence of human involvement.",
  "tags": [
    "ai-visuals",
    "high-output",
    "minimal-bio",
    "no-social-presence"
  ],
  "spotify": "4xk4YzPhEw1csQwvRfs3Lh",
  "apple": "1823338461",
  "amazon": "B0FFYK5MM1",
  "youtube": "@luminaryfluxband",
  "tiktok": null,
  "instagram": "luminary.flux",
  "urls": []
}
