{
  "id": "fable0x",
  "name": "Fable0x",
  "dateAdded": "2025-12-21T20:47:19.000Z",
  "dateUpdated": "2025-12-22T21:48:42.000Z",
  "comments": "Acknowledges they are AI-generated in their Discord.",
  "tags": [],
  "spotify": "https://open.spotify.com/artist/4YvG2DXblKm8bHp8MHkJj7",
  "apple": "https://music.apple.com/us/artist/1781327584",
  "youtube": "https://www.youtube.com/@Fable0x",
  "instagram": "https://www.instagram.com/fable0x",
  "tiktok": "https://www.tiktok.com/@fable0x",
  "amazon": "https://music.amazon.com/artists/B0DNV8W1J9",
  "urls": []
}
