{
  "id": "onepix",
  "name": "Onepix",
  "dateAdded": "2025-12-07T22:24:51.000Z",
  "dateUpdated": "2025-12-22T15:33:20.000Z",
  "comments": null,
  "tags": [
    "anonymous",
    "high-output"
  ],
  "spotify": "https://open.spotify.com/artist/60jnmZuQLow54kbbmy0zh2",
  "apple": "https://music.apple.com/us/artist/1508051735",
  "youtube": "https://www.youtube.com/@OnepixMixtape",
  "instagram": null,
  "tiktok": null,
  "amazon": "https://music.amazon.com/artists/B087R6CQNG",
  "urls": []
}
