{
  "id": "fading-north",
  "name": "Fading North",
  "dateAdded": "2025-12-08",
  "dateUpdated": "2025-12-13",
  "comments": null,
  "tags": [
    "high-output"
  ],
  "spotify": "https://open.spotify.com/artist/6bC3glGuAWl1eexEEv7aKe",
  "apple": "https://music.apple.com/us/artist/1845566861",
  "youtube": "https://www.youtube.com/channel/UCFeea9zFTXvx6xyacVCfqKQ",
  "instagram": null,
  "tiktok": "https://www.tiktok.com/@fadingnorth",
  "amazon": "https://music.amazon.com/artists/B0FFHFX1YT",
  "urls": []
}
