{
  "id": "e-qurnaz",
  "name": "EQurnaz",
  "dateAdded": "2025-12-17T16:46:33.000Z",
  "dateUpdated": "2025-12-23T16:50:37.000Z",
  "comments": null,
  "tags": [
    "high-output"
  ],
  "spotify": "https://open.spotify.com/artist/5jKGaookPozBP99M72GN4O",
  "apple": "https://music.apple.com/us/artist/718674037",
  "youtube": "https://www.youtube.com/@EQurnaz",
  "instagram": null,
  "tiktok": "https://www.tiktok.com/@equrnaz",
  "amazon": "https://music.amazon.com/artists/B00FZOPTSY",
  "urls": []
}
