{
  "id": "break-me-open",
  "name": "Break Me Open",
  "dateAdded": "2025-12-23T15:06:03.000Z",
  "dateUpdated": "2025-12-23T16:48:38.000Z",
  "comments": "Stereotypical sound and visuals, found on station playlist made up exclusively of other AI \"artists\".  Cover art has the telltale signs, no band socials, no background or previous history.",
  "tags": [
    "minimal-bio",
    "no-social-presence",
    "ai-visuals",
    "anonymous",
    "high-output"
  ],
  "spotify": "https://open.spotify.com/artist/44cdc5PhT5bCqd8PJxywac",
  "apple": "https://music.apple.com/us/artist/1859406993",
  "youtube": "https://www.youtube.com/channel/UCq0HN8J9iAikbjisrGyw2ww",
  "instagram": null,
  "tiktok": null,
  "amazon": "https://music.amazon.com/artists/B0G5LFFFXB",
  "urls": []
}
