{
  "id": "celestial-tunes",
  "name": "Celestial Tunes",
  "dateAdded": "2025-12-17T15:14:17.000Z",
  "dateUpdated": "2025-12-23T15:06:27.000Z",
  "comments": "AI generated artwork; releases only from 2025 onwards",
  "tags": [
    "high-output"
  ],
  "spotify": "https://open.spotify.com/artist/3M4cwppElD5XYtbCMvOO50",
  "apple": "https://music.apple.com/us/artist/1860276710",
  "youtube": "https://www.youtube.com/@celestialtunes1",
  "instagram": null,
  "tiktok": null,
  "amazon": "https://music.amazon.com/artists/B0FZJ286QF",
  "urls": []
}
