{
  "id": "ava-veex",
  "name": "Ava Veex",
  "dateAdded": "2025-12-27T12:49:47.000Z",
  "dateUpdated": "2026-01-02T11:32:31.000Z",
  "comments": "The sound resembles Luna Veex, another artist suspected to be AI-generated. Both have similar Spotify bio descriptions, and the YouTube channel is linked to the Luna Veex TikTok account.",
  "tags": [
    "ai-visuals",
    "anonymous",
    "high-output",
    "minimal-bio",
    "no-social-presence"
  ],
  "spotify": "1TjyGerbNRYiAw7AHQg8eh",
  "apple": "1840826883",
  "amazon": "B0FRSL6VQH",
  "youtube": "@avaveex",
  "tiktok": "@avaveex",
  "instagram": null,
  "urls": []
}
