{
  "id": "pie-for-billy",
  "name": "Pie For Billy",
  "dateAdded": "2025-12-20",
  "dateUpdated": null,
  "comments": "basically admits they use AI assistance. I believe they also said they do use AI for some parts of their music on an Instagram comment",
  "tags": [
    "partial-ai",
    "high-output"
  ],
  "spotify": "https://open.spotify.com/artist/3djeIfXzxwOgWLOkkWzkHj",
  "apple": "https://music.apple.com/us/artist/1818085990",
  "youtube": "https://www.youtube.com/@PieForBillyMusic",
  "instagram": "https://www.instagram.com/pieforbilly",
  "tiktok": "https://www.tiktok.com/@pieforbilly",
  "amazon": "https://music.amazon.com/artists/B0FBMKW5SW/pie-for-billy",
  "urls": [
    "https://humachinerecords.com"
  ]
}
