{
  "id": "neytan",
  "name": "Neytan",
  "dateAdded": "2025-11-25T12:12:56.000Z",
  "dateUpdated": "2025-12-30T17:10:42.000Z",
  "comments": null,
  "tags": [],
  "spotify": "29sDg3OXbYCg0SDuYBqP2G",
  "apple": "1840918659",
  "amazon": null,
  "youtube": null,
  "tiktok": "@neytan__official",
  "instagram": "neytan__official",
  "urls": []
}
