{
  "id": "badger-sounds",
  "name": "Badger Sounds",
  "dateAdded": "2025-11-27T16:46:08.000Z",
  "dateUpdated": "2025-12-25T23:27:01.000Z",
  "comments": null,
  "tags": [],
  "spotify": "64XVZA95MFE7smlQOsEQX4",
  "apple": null,
  "amazon": null,
  "youtube": "@badgersoundsofficial",
  "tiktok": null,
  "instagram": "badgersoundsmusic",
  "urls": []
}
