{
  "id": "sol",
  "name": "Sol.",
  "dateAdded": "2025-12-07",
  "dateUpdated": "2025-12-13",
  "comments": null,
  "tags": [
    "high-output",
    "anon-project"
  ],
  "spotify": "https://open.spotify.com/artist/06bsQwVfa3ysH7MH2b3N6p",
  "apple": "https://music.apple.com/us/artist/1845570347",
  "youtube": null,
  "instagram": null,
  "tiktok": null,
  "amazon": "https://music.amazon.com/artists/B07LGRKG3P",
  "urls": []
}
