{
  "id": "just-irish-music",
  "name": "Just Irish Music",
  "dateAdded": "2025-12-12T09:27:49.000Z",
  "dateUpdated": "2025-12-30T18:56:26.000Z",
  "comments": null,
  "tags": [
    "high-output",
    "anonymous"
  ],
  "spotify": "2EHyY4pmTwQYuJ0ZKKohHb",
  "apple": "1824707923",
  "amazon": "B0FGRHFQ25",
  "youtube": "@justirishmusic",
  "tiktok": null,
  "instagram": "justirishmusic",
  "urls": []
}
