{
  "id": "velvet-desires",
  "name": "velvet desires",
  "dateAdded": "2025-12-17T15:12:39.000Z",
  "dateUpdated": "2025-12-22T17:13:34.000Z",
  "comments": null,
  "tags": [
    "high-output"
  ],
  "spotify": "https://open.spotify.com/artist/5xTlKmwStlbbmASPg7u3zr",
  "apple": "https://music.apple.com/us/artist/1842949813",
  "youtube": "https://www.youtube.com/channel/UCpji-HG-cg18GTd2iwOTBJw",
  "instagram": "https://www.instagram.com/velvetdesiresmusic6",
  "tiktok": "https://www.tiktok.com/@velvetdesiresmusic",
  "amazon": "https://music.amazon.com/artists/B0FT6VMZ3W",
  "urls": []
}
