{
  "id": "raven-knight",
  "name": "Raven Knight",
  "dateAdded": "2025-11-24T23:56:10.000Z",
  "dateUpdated": "2025-12-23T14:51:13.000Z",
  "comments": null,
  "tags": [],
  "spotify": "https://open.spotify.com/artist/2lGM5OCIrdO8VK5Pdt6QgX",
  "apple": "https://music.apple.com/us/artist/1834697328",
  "youtube": null,
  "instagram": null,
  "tiktok": null,
  "amazon": null,
  "urls": []
}
