{
  "id": "blackbeards-tavern",
  "name": "Blackbeards Tavern",
  "dateAdded": "2025-11-25",
  "dateUpdated": "2025-12-07",
  "comments": "Music created by AI, lyrics made by human",
  "tags": [],
  "spotify": "https://open.spotify.com/artist/5wI5SeZBRJ9nWKgS9oJAQc",
  "apple": "https://music.apple.com/us/artist/1778555396",
  "youtube": "https://www.youtube.com/@BlackbeardsTavern",
  "instagram": null,
  "tiktok": null,
  "amazon": null,
  "urls": []
}
