{
  "id": "full-metal-patriot",
  "name": "Full Metal Patriot",
  "dateAdded": "2025-12-09T21:57:45.000Z",
  "dateUpdated": "2025-12-23T16:50:37.000Z",
  "comments": null,
  "tags": [],
  "spotify": "https://open.spotify.com/artist/0Yv8vhih8fGBPB4XgARXo1",
  "apple": "https://music.apple.com/us/artist/1816191618",
  "youtube": "https://www.youtube.com/@TheFullMetalPatriot",
  "instagram": "https://www.instagram.com/metalpatriotx",
  "tiktok": "https://www.tiktok.com/@metalpatriotx",
  "amazon": "https://music.amazon.com/artists/B0F9PV5HNS",
  "urls": []
}
