{
  "id": "everfade",
  "name": "EVERFADE",
  "dateAdded": "2025-12-10T16:56:06.000Z",
  "dateUpdated": "2025-12-30T17:10:42.000Z",
  "comments": null,
  "tags": [],
  "spotify": "55QoipFnVQfUvMbYumTXrd",
  "apple": "1839393966",
  "amazon": "B011T321D0",
  "youtube": "@EVERFADEband",
  "tiktok": "@everfadeband",
  "instagram": "everfadeband",
  "urls": []
}
