{
  "id": "lyryxx",
  "name": "LYRYXX",
  "dateAdded": "2025-12-18T17:16:04.000Z",
  "dateUpdated": "2025-12-22T16:56:05.000Z",
  "comments": null,
  "tags": [
    "anonymous"
  ],
  "spotify": "https://open.spotify.com/artist/31SVvG3RROXlN03ez3h7F3",
  "apple": null,
  "youtube": "https://www.youtube.com/channel/UC4DATTYt0_1Sugh1XwmnCeQ",
  "instagram": null,
  "tiktok": "https://www.tiktok.com/@lyryxx8",
  "amazon": "https://music.amazon.com/artists/B0G4BFRLZH",
  "urls": []
}
